Term,Date,Headline,Category
Klimaforandringer,14. august 2023,DMI: Nu kommer varmen. Men ...,Indland
Klimaforandringer,11. august 2023,Rekordvarm måned på toppen af Grønlands indlandsis,Indland
Klimaforandringer,11. august 2023,Østjysk vinproducent overrasket over klimaforandringer: Har foræret 1.000 vinstokke væk,JP Aarhus
Klimaforandringer,11. august 2023,Værste katastrofe på Hawaii i 60 år: 53 døde i skovbrande,USA
Klimaforandringer,11. august 2023,"Niels Th. Dahl: Regeringens argumenter i koran-sagen stikker i alle retninger – men der er ét, den ikke vil sige så højt",Politik
Klimaforandringer,9. august 2023,Skovbrande har opslugt turistdestinationer og dræbt seks i Hawaii,USA
Klimaforandringer,9. august 2023,Eksperter undrer sig: Unesco fjerner berømt koralrev fra liste over truede økosystemer,Rejser
Klimaforandringer,9. august 2023,"Ny alliance skaber håb for verdens største regnskov: Nu skal Amazonas reddes, før det er for sent",International
Klimaforandringer,5. august 2023,Canada står midt i den værste skovbrandssæson nogensinde,International
Klimaforandringer,4. august 2023,Loch Ness-uhyrets hjemsted er ramt af klimaforandringer,Europa
CO2-udledning,13. august 2023,Ambitiøse klimamål er ikke nok – der er også behov for teknologiske løsninger,Debatindlæg
CO2-udledning,12. august 2023,Europæisk oprustning på grønt må ikke skubbe danske virksomheder bagerst i feltet,Debatindlæg
CO2-udledning,11. august 2023,Vil skabe milliardfirma: Tre tidligere Arla-direktører vil revolutionere mejeribranchen,JP Erhverv
CO2-udledning,10. august 2023,Håbede på 20-25.000 kr. til klimaprojekt: Beløbet de fik i støtte var et ganske andet,JP Aarhus
CO2-udledning,7. august 2023,Vilde løfter: 11 topchefer giver baghjul til Danmarks samlede klimamål,JP Erhverv
CO2-udledning,4. august 2023,Eksperter: Milliardregnen over energimarkedet fortsætter i årevis,JP Erhverv
CO2-udledning,1. august 2023,Hård kritik: Danske virksomheder fører klimakamp i blinde,JP Forside
CO2-udledning,29. juli 2023,"Vi er dybt uansvarlige, når vi fortsætter med at importere fossilbiler",Debatindlæg
CO2-udledning,27. juli 2023,"DI afviser klimakritik: »Når der er sat nogle mål, så skal de selvfølgelig også efterleves«",JP Erhverv
CO2-udledning,26. juli 2023,Charterrejsen er ikke længere en rettighed,Kommentar
